{
  "schema_version": "2.1",
  "id": "core-input-20260930-holder-pullback",
  "revision": 1,
  "status": "accepted",
  "base_commit": "e821fb6920b5ebb48e36a84792926caf8be75acd",
  "objective": {
    "title": "Construct actual nonlinear parabolic Holder pullback",
    "statement": "Core assumption addressed: UniversalHamiltonConvergenceStatement via genuine Ricci-flow/DeTurck inputs. The preceding gated constructor provides actual smooth compact F. Construct bounded carrier operators and time-uniform norms from F alone. Subsequent consumer: derivative-compatible Graph pullback, bounded destination-only tensor transport and actual global L/P/R assembly. Do not accept supplied operators, bounds, flows or sphere recognition.",
    "deliverables": [
      "Poincare.ParabolicSpatialHolderPullback.exists_spatial_Y_pullback"
    ]
  },
  "scope": {
    "allowed_paths": [
      "Poincare/Global/ParabolicSpatialHolderPullback.lean"
    ],
    "forbidden_paths": [
      "Poincare.lean",
      "HANDOFF.md",
      "Poincare/Statement.lean",
      "Poincare/Global/Statement.lean",
      "lean-toolchain",
      "lake-manifest.json",
      "harness/v2/contracts/**",
      "Poincare/Global/RiemannianContext.lean",
      "Poincare/Global/ParabolicHolderSpace.lean"
    ]
  },
  "context": {
    "files": [
      "README.md",
      "HANDOFF.md",
      "docs/PROJECT_MAP.md",
      "AGENTS.md",
      "harness/v2/contracts/core-chart-transport-20260930/holder-pullback.readback.json",
      "harness/v2/contracts/core-chart-transport-20260930/holder-construction-context.md",
      "Poincare/Global/ParabolicHolderSpace.lean",
      "Poincare/Global/FrozenEllipticHeatOperator.lean"
    ],
    "symbols": [
      "Poincare.ParabolicSpatialHolderPullback.exists_spatial_Y_pullback"
    ],
    "depends_on": [
      "core-input-20260930-gated-transitions"
    ]
  },
  "acceptance": {
    "commands": [
      [
        "env",
        "LEAN_NUM_THREADS=1",
        "lake",
        "env",
        "lean",
        "Poincare/Global/ParabolicSpatialHolderPullback.lean"
      ],
      [
        "rg",
        "--files-without-match",
        "\\b(sorry|admit|axiom|opaque|postulate)\\b|native_decide",
        "Poincare/Global/ParabolicSpatialHolderPullback.lean"
      ],
      [
        "git",
        "diff",
        "--check"
      ],
      [
        "python3",
        "scripts/frozen_contract_audit.py",
        "--manifest",
        "harness/v2/contracts/core-chart-transport-20260930/holder-pullback.contract.json"
      ]
    ],
    "required_declarations": [
      "Poincare.ParabolicSpatialHolderPullback.exists_spatial_Y_pullback"
    ],
    "forbidden_added_tokens": [
      "sorry",
      "admit",
      "axiom",
      "opaque",
      "postulate",
      "native_decide"
    ]
  },
  "stop_conditions": [
    "Complete only when exact frozen target and all scoped gates pass.",
    "If blocked preserve exact resisting type and every compiler attempt; no unfinished committed proof or weakened target.",
    "Do not supply fake atlas/metric/curvature/sphere/operator/limit witnesses, edit frozen definitions/root or perform full builds, acceptance, merges or service operations."
  ],
  "budget": {
    "max_attempts": 3,
    "wall_clock_minutes": 120,
    "max_output_tokens": 30000,
    "disk_mb": 4096
  },
  "statement_contract": {
    "imports": [
      "Poincare.Global.ParabolicSpatialHolderPullback"
    ],
    "declarations": [
      {
        "name": "Poincare.ParabolicSpatialHolderPullback.exists_spatial_Y_pullback",
        "lean_type": "\u2200 {V : Type v} [NormedAddCommGroup V] [NormedSpace \u211d V],\n\u2200 (F : (Poincare.ClosedSmoothModel 3) \u2192 (Poincare.ClosedSmoothModel 3)), ContDiff \u211d ((\u22a4 : ENat) : WithTop ENat) F \u2192 HasCompactSupport F \u2192\n\u2200 (\u03b1 : \u211d), 0 \u2264 \u03b1 \u2192 \u2203 C : \u211d, 0 \u2264 C \u2227 \u2200 T : \u211d,\n\u2203 Q : (Poincare.ParabolicHolder.Y (E := (Poincare.ClosedSmoothModel 3)) \u03b1 T V) \u2192L[\u211d] (Poincare.ParabolicHolder.Y (E := (Poincare.ClosedSmoothModel 3)) \u03b1 T V), \u2016Q\u2016 \u2264 C \u2227 \u2200 f p, Q f p = f (p.1, F p.2)",
        "universes": [
          "v"
        ]
      }
    ],
    "definition_files": [
      {
        "path": "Poincare/Global/RiemannianContext.lean",
        "sha256": "735a43227e216688b739d8a09ca613da72f07f3acfe3b4f5d8d7feaab662705a"
      },
      {
        "path": "Poincare/Global/ParabolicHolderSpace.lean",
        "sha256": "0e60ecea8e5a50a97149a989bf5e262ecb27274a60a40dbd64ee0af9ee05d192"
      }
    ],
    "author": "root-orchestrator",
    "review": {
      "reviewer": "chart-extension-readback",
      "method": "blind-readback",
      "snapshot_sha256": "09fd49d76865b0c54abab37c43ff2e6c5677e1c242365ae50c6e0804e81b3e9a",
      "verdict": "approved",
      "report_path": "harness/v2/contracts/core-chart-transport-20260930/holder-pullback.readback.json",
      "report_sha256": "7de8e17731028c15f6920822384e3e98fd3bebea099ba68b4d2f99f61489a2a2"
    }
  },
  "accepted_commit": "0a22321f4ceadd7edcf2ccc5670a4201006c7348"
}
