{
  "schema_version": "2.1",
  "id": "core-input-20260930-tensor-compatibility",
  "revision": 1,
  "status": "ready",
  "base_commit": "9e25167310598977db7dd716edf4aed40f298d18",
  "objective": {
    "title": "Prove actual buffered finite tensor compatibility for Hamilton inputs",
    "statement": "Core assumption helped: UniversalHamiltonConvergenceStatement through actual general Ricci flow. Subsequent proof: finite sum of actual Graph transport operators belongs to X_M, then actual global P:Y_M ->L X_M and signed DeTurck L/P/R contraction. Prove the actual defined finite value sum, without replacing construction by unconstructed tensor/operator packages.",
    "deliverables": [
      "Poincare.FiniteAtlasBufferedTensorValue.weighted_transition",
      "Poincare.FiniteAtlasBufferedTensorValue.symmetric"
    ]
  },
  "scope": {
    "allowed_paths": [
      "Poincare/Global/FiniteAtlasBufferedTensorValueCompatibility.lean"
    ],
    "forbidden_paths": [
      "Poincare.lean",
      "HANDOFF.md",
      "Poincare/Statement.lean",
      "Poincare/Global/Statement.lean",
      "lean-toolchain",
      "lake-manifest.json",
      "harness/v2/contracts/**",
      "Poincare/Global/RiemannianContext.lean",
      "Poincare/Global/ParabolicHolderSpace.lean",
      "Poincare/Global/ParabolicSolutionGraph.lean",
      "Poincare/Global/BufferedTensorGraphTransportDefinitions.lean",
      "Poincare/Global/FiniteAtlasBufferedTensorValueDefinitions.lean"
    ]
  },
  "context": {
    "files": [
      "README.md",
      "HANDOFF.md",
      "docs/PROJECT_MAP.md",
      "AGENTS.md",
      "harness/v2/contracts/core-tensor-transport-20260930/compatibility.readback.json",
      "harness/v2/contracts/core-tensor-transport-20260930/compatibility-context.md",
      "Poincare/Global/FiniteAtlasBufferedTensorValueDefinitions.lean",
      "Poincare/Global/FiniteAtlasJacobianCocycle.lean",
      "Poincare/Global/FiniteAtlasParabolicTensorSpace.lean"
    ],
    "symbols": [
      "Poincare.FiniteAtlasBufferedTensorValue.weighted_transition",
      "Poincare.FiniteAtlasBufferedTensorValue.symmetric"
    ],
    "depends_on": []
  },
  "acceptance": {
    "commands": [
      [
        "env",
        "LEAN_NUM_THREADS=1",
        "lake",
        "env",
        "lean",
        "Poincare/Global/FiniteAtlasBufferedTensorValueCompatibility.lean"
      ],
      [
        "rg",
        "--files-without-match",
        "\\b(sorry|admit|axiom|opaque|postulate)\\b|native_decide",
        "Poincare/Global/FiniteAtlasBufferedTensorValueCompatibility.lean"
      ],
      [
        "git",
        "diff",
        "--check"
      ],
      [
        "python3",
        "scripts/frozen_contract_audit.py",
        "--manifest",
        "harness/v2/contracts/core-tensor-transport-20260930/compatibility.contract.json"
      ]
    ],
    "required_declarations": [
      "Poincare.FiniteAtlasBufferedTensorValue.weighted_transition",
      "Poincare.FiniteAtlasBufferedTensorValue.symmetric"
    ],
    "forbidden_added_tokens": [
      "sorry",
      "admit",
      "axiom",
      "opaque",
      "postulate",
      "native_decide"
    ]
  },
  "stop_conditions": [
    "Complete only when exact frozen target and all scoped gates pass.",
    "If blocked preserve exact resisting type and every compiler attempt; no unfinished committed proof or weakened target.",
    "Do not supply fake atlas/metric/curvature/sphere/operator/limit witnesses, edit frozen definitions/root or perform full builds, acceptance, merges or service operations."
  ],
  "budget": {
    "max_attempts": 3,
    "wall_clock_minutes": 120,
    "max_output_tokens": 30000,
    "disk_mb": 4096
  },
  "statement_contract": {
    "imports": [
      "Poincare.Global.FiniteAtlasBufferedTensorValueCompatibility"
    ],
    "declarations": [
      {
        "name": "Poincare.FiniteAtlasBufferedTensorValue.weighted_transition",
        "lean_type": "∀ (M : Type u) [TopologicalSpace M]\n[ChartedSpace (Poincare.ClosedSmoothModel 3) M]\n[IsManifold (Poincare.closedSmoothModelWithCorners 3) ((⊤ : ENat) : WithTop ENat) M]\n(A : Poincare.FiniteAtlasParabolicTensorSpace.AtlasData M)\n(ξ : Fin A.cover.chartCount → Poincare.ClosedSmoothModel 3 → ℝ)\n(W : Fin A.cover.chartCount → Fin 3 → Fin 3 → Poincare.ClosedSmoothModel 3 → ℝ),\n∀ (i k : Fin A.cover.chartCount) (a b : Fin 3) (x : M),\nx ∈ (Poincare.FiniteAtlasParabolicTensorSpace.chart A i).source → x ∈ (Poincare.FiniteAtlasParabolicTensorSpace.chart A k).source →\nA.partition k x * Poincare.FiniteAtlasBufferedTensorValue.value A ξ W i a b x =\nA.partition i x * ∑ p : Fin 3, ∑ q : Fin 3,\n (Poincare.FiniteAtlasParabolicTensorSpace.jac A i k x p a * Poincare.FiniteAtlasParabolicTensorSpace.jac A i k x q b) * Poincare.FiniteAtlasBufferedTensorValue.value A ξ W k p q x",
        "universes": [
          "u"
        ]
      },
      {
        "name": "Poincare.FiniteAtlasBufferedTensorValue.symmetric",
        "lean_type": "∀ (M : Type u) [TopologicalSpace M]\n[ChartedSpace (Poincare.ClosedSmoothModel 3) M]\n[IsManifold (Poincare.closedSmoothModelWithCorners 3) ((⊤ : ENat) : WithTop ENat) M]\n(A : Poincare.FiniteAtlasParabolicTensorSpace.AtlasData M)\n(ξ : Fin A.cover.chartCount → Poincare.ClosedSmoothModel 3 → ℝ)\n(W : Fin A.cover.chartCount → Fin 3 → Fin 3 → Poincare.ClosedSmoothModel 3 → ℝ),\n(∀ j a b z, W j a b z = W j b a z) →\n∀ i a b x, Poincare.FiniteAtlasBufferedTensorValue.value A ξ W i a b x = Poincare.FiniteAtlasBufferedTensorValue.value A ξ W i b a x",
        "universes": [
          "u"
        ]
      }
    ],
    "definition_files": [
      {
        "path": "Poincare/Global/RiemannianContext.lean",
        "sha256": "735a43227e216688b739d8a09ca613da72f07f3acfe3b4f5d8d7feaab662705a"
      },
      {
        "path": "Poincare/Global/FiniteAtlasParabolicTensorSpace.lean",
        "sha256": "e195bfe093f55144464814758b32bd5d266639e41bf9581401e9b9087dcd8f7c"
      },
      {
        "path": "Poincare/Global/FiniteAtlasBufferedTensorValueDefinitions.lean",
        "sha256": "12128cd9874e24db5aa594daee3716dd942c7fab84c6cc711777129d68f98620"
      }
    ],
    "author": "root-orchestrator",
    "review": {
      "reviewer": "tensor-transport-readback",
      "method": "blind-readback",
      "snapshot_sha256": "951ceee7cb3d903c781e628e8cbebad3d0504d696a6cb13e62d538aec724bf86",
      "verdict": "approved",
      "report_path": "harness/v2/contracts/core-tensor-transport-20260930/compatibility.readback.json",
      "report_sha256": "676467976a68962887e3282685672dda548bb31e1c289bcf4e7f77461638b72a"
    }
  }
}
